{
  "$schema": "https://json-schema.org/draft/2020-12/schema",
  "$id": "https://vicekrack.local/schemas/trading/market-data-config.schema.json",
  "title": "Market data import and replay limits 1.0",
  "description": "Local limits for importing and replaying market data. No feeds, credentials or network settings.",
  "type": "object",
  "additionalProperties": false,
  "required": [
    "config_version",
    "allowed_intervals",
    "limits",
    "replay"
  ],
  "properties": {
    "config_version": {
      "const": "1.0"
    },
    "description": {
      "type": "string",
      "maxLength": 300
    },
    "allowed_intervals": {
      "type": "array",
      "minItems": 1,
      "uniqueItems": true,
      "items": {
        "$ref": "#/$defs/interval"
      }
    },
    "limits": {
      "type": "object",
      "additionalProperties": false,
      "required": [
        "max_file_bytes",
        "max_rows",
        "max_field_length",
        "max_gap_entries"
      ],
      "properties": {
        "max_file_bytes": {
          "type": "integer",
          "minimum": 100,
          "maximum": 50000000
        },
        "max_rows": {
          "type": "integer",
          "minimum": 1,
          "maximum": 1000000
        },
        "max_field_length": {
          "type": "integer",
          "minimum": 8,
          "maximum": 200
        },
        "max_gap_entries": {
          "type": "integer",
          "minimum": 1,
          "maximum": 10000
        }
      }
    },
    "replay": {
      "type": "object",
      "additionalProperties": false,
      "required": [
        "max_steps",
        "max_window_bars",
        "max_report_steps"
      ],
      "properties": {
        "max_steps": {
          "type": "integer",
          "minimum": 1,
          "maximum": 100000
        },
        "max_window_bars": {
          "type": "integer",
          "minimum": 1,
          "maximum": 10000
        },
        "max_report_steps": {
          "type": "integer",
          "minimum": 1,
          "maximum": 10000
        }
      }
    }
  },
  "$defs": {
    "timestamp": {
      "type": "string",
      "pattern": "^[0-9]{4}-(0[1-9]|1[0-2])-(0[1-9]|[12][0-9]|3[01])T([01][0-9]|2[0-3]):[0-5][0-9]:[0-5][0-9]Z$"
    },
    "decimal": {
      "description": "Non-negative decimal as a string (no floats, exponents, NaN or infinity).",
      "type": "string",
      "pattern": "^(0|[1-9][0-9]{0,17})(\\.[0-9]{1,8})?$"
    },
    "signed_decimal": {
      "type": "string",
      "pattern": "^-?(0|[1-9][0-9]{0,17})(\\.[0-9]{1,8})?$"
    },
    "money": {
      "description": "Non-negative amount in account currency, at most 2 decimal places.",
      "type": "string",
      "pattern": "^(0|[1-9][0-9]{0,15})(\\.[0-9]{1,2})?$"
    },
    "signed_money": {
      "type": "string",
      "pattern": "^-?(0|[1-9][0-9]{0,15})(\\.[0-9]{1,2})?$"
    },
    "symbol": {
      "type": "string",
      "pattern": "^[A-Z][A-Z0-9.-]{0,14}$"
    },
    "code": {
      "type": "string",
      "pattern": "^[a-z0-9_]{1,60}$"
    },
    "identifier": {
      "type": "string",
      "pattern": "^[a-z0-9][a-z0-9_-]{0,63}$"
    },
    "sha256": {
      "type": "string",
      "pattern": "^[0-9a-f]{64}$"
    },
    "local_timestamp": {
      "type": "string",
      "description": "RFC 3339 local time with explicit UTC offset.",
      "pattern": "^[0-9]{4}-(0[1-9]|1[0-2])-(0[1-9]|[12][0-9]|3[01])T([01][0-9]|2[0-3]):[0-5][0-9]:[0-5][0-9][+-]([01][0-9]|2[0-3]):[0-5][0-9]$"
    },
    "timezone": {
      "type": "string",
      "maxLength": 60,
      "pattern": "^(UTC|[A-Z][A-Za-z_]+(/[A-Z][A-Za-z_+-]+){1,2})$"
    },
    "interval": {
      "enum": [
        "1m",
        "5m",
        "15m",
        "30m",
        "1h",
        "1d"
      ]
    },
    "label": {
      "enum": [
        "synthetic",
        "historical",
        "delayed",
        "unknown"
      ],
      "description": "What the importer declared. Never verified."
    },
    "currency": {
      "type": "string",
      "pattern": "^[A-Z]{3}$"
    },
    "dataset_id": {
      "type": "string",
      "pattern": "^mds-[0-9a-f]{24}$"
    },
    "source": {
      "type": "object",
      "additionalProperties": false,
      "required": [
        "adapter",
        "name"
      ],
      "properties": {
        "adapter": {
          "enum": [
            "synthetic_fixture",
            "local_csv",
            "alpaca_historical"
          ]
        },
        "name": {
          "type": "string",
          "pattern": "^[A-Za-z0-9][A-Za-z0-9 ._-]{0,79}$"
        }
      }
    }
  }
}
