{
  "config_version": "1.0",
  "description": "Offline market-data import and replay limits (Step 25). No feeds, no credentials, no network.",
  "allowed_intervals": [
    "1m",
    "5m",
    "15m",
    "30m",
    "1h",
    "1d"
  ],
  "limits": {
    "max_file_bytes": 5000000,
    "max_rows": 100000,
    "max_field_length": 64,
    "max_gap_entries": 1000
  },
  "replay": {
    "max_steps": 5000,
    "max_window_bars": 500,
    "max_report_steps": 500
  }
}
